time,text,mode,size,color,user,likes
2743.76,二爷千古,1,25,16777215,7bb5d06d,0
2566.28,关羽还不快快受死，我乃江东浙江人士。哈哈哈,1,25,16777215,24bb9704,0
1957.26,关羽还不快快受死，我,1,25,16777215,24bb9704,0
1153.643,血压一下就上来了,1,25,16777215,24bb9704,0
2717.831,我爱你二爷,1,25,16707842,519dd1b5,0
2621.776,二爷,1,25,16707842,519dd1b5,0
1839.397,突然喜欢上曹老板了,1,25,16707842,519dd1b5,0
659.941,人家拿了荆州是要投降的,5,25,16707842,519dd1b5,0
372.859,喜欢曹操和刘备，就是讨厌孙权,5,25,16777215,519dd1b5,0
181.265,二爷啊呜呜呜,1,25,16777215,519dd1b5,0
614.147,孙权的后代有日本人,1,25,16777215,977699b8,0
595.627,日本祖宗:孙…,1,25,16777215,977699b8,0
340.786,江东鼠辈，利用国际约定！跟日本杀南京有什么区别？？？,1,25,16777215,977699b8,0
303.746,江东鼠辈！！！偷袭背刺坑盟！！！,1,25,16777215,977699b8,0
234.866,江东皆鼠辈，尔等勿休驳！！！,1,25,16777215,977699b8,0
260.957,鼠辈无双（吕蒙）,1,25,16777215,977699b8,0
186.756,而今二爷破曹贼，碧眼小儿背刺乱！！！,1,25,16777215,977699b8,0
184.797,大魏吴王孙十万，张辽八百吓破胆,1,25,16777215,977699b8,0
179.316,江东东吴皆鼠辈！背刺武圣落人还！,1,25,16777215,977699b8,0
2496.971,日后只能玩全站三国 继承蜀汉的遗志了。,1,25,16777215,a1965f15,0
2347.579,破防了啊！,1,25,16777215,6f4a3d7b,0
2345.162,我的好兄弟，不是一首歌吗？,1,25,15138834,297fb5a9,0
2345.985,为将军提刀携马，在所不辞！,1,25,16777215,6581e2e6,0
2461.756,正因为有这些忠诚情义人士，这段历史才值得我们一遍一遍回味，是人性的光辉,1,25,16777215,4a940293,0
1063.116,对啊，赶紧找刘备啊，因为关羽一死，刘备容易心乱，就会出现连环错误,1,25,16777215,4a940293,0
2555.629,这是最绝望的,1,25,16777215,e7056143,0
2132.244,这雪跟顾茅庐那天的一样大,1,25,16777215,e7056143,0
2065.87,不，打西门,1,25,16777215,e7056143,0
1984.288,太刚了，这时候稍稍想一下伍子胥,1,25,16777215,e7056143,0
1846.635,只空北门,1,25,16777215,e7056143,0
1760.475,季汉团结无间,1,25,16777215,e7056143,0
1688.233,季汉的忠，信，义，勇加上刘备之仁属实无敌,1,25,16777215,e7056143,0
1206.073,以商犯军属实界限不清鼠辈之术让武将瞧不起了,1,25,16777215,e7056143,0
1036.829,失地存人从长计议徐图之是唯一选项,1,25,16777215,e7056143,0
1972.854,我有一计：插眼汉中传送,1,25,16777215,f7bbd3e3,0
585.978,肯定是通过衣服什么的确认，那会儿谁能上帝视角想到那么周全,1,25,16777215,e7056143,0
548.165,演义可不是历史，而是以史为story宣传自己的观念,1,25,16777215,e7056143,0
473.754,东吴这种行为从战术角度而言就是鼠辈，武将不屑,1,25,16777215,e7056143,0
330.213,跟不能在酒里下毒是一个道理，下一次毒以后所有武将都不能喝酒了，计谋归计谋，诚信是诚信,1,25,16777215,e7056143,0
2140.666,子龙在就好了,5,25,15138834,37795c32,0
276.826,这些小兵好像复制转录的,1,25,16777215,e7056143,0
2083.066,大路小路都一样,5,25,15138834,37795c32,0
1841.106,杀关羽是最错误的一步棋  ,5,25,15138834,37795c32,0
861.51,徐晃，当初在华容怎么不说这句话？,1,25,16777215,b8031677,0
1241.506,现在回去一切还来得及  存人失地  人地皆存  留得青山在，不愁没柴烧。啊  ,5,25,15138834,37795c32,0
1854.686,战火全引过来了,1,25,16777215,a9bb2c87,0
1818.443,真打的话，刘备肯定会复仇打你，最后两败俱伤，基本就完了,1,25,16777215,a9bb2c87,0
2520.633,化整为零，全部换成百姓，各处四散吧，回汉中吧,1,25,16777215,1c0ac304,0
2621.819,武圣归位,1,25,16777215,800d26d9,0
1702.339,千秋忠义,1,25,16777215,800d26d9,0
1918.274,你们一口一个东吴，说的可能是现在南方省份某些人的祖上,1,25,16777215,371fa167,0
1412.997,东吴下死手，关氏一族不保,1,25,16777215,371fa167,0
1180.522,糜竺孙乾可是最大股东，糜芳长坂坡不是还说赵云投曹操去了,1,25,16777215,371fa167,0
1144.054,关羽全家无一幸免，都被东吴处死了,1,25,16777215,371fa167,0
987.063,关羽全家无一幸免,1,25,16777215,371fa167,0
778.87,关羽前面被诸葛亮夸又被陆逊夸，又是五虎大将，何况太傲气,1,25,16777215,371fa167,0
1279.181,曹操什么基本盘，能比吗,1,25,16777215,f4415ee8,0
710.443,大棚歌舞,1,25,16777215,69b8501d,0
1948.917,举白旗吧,1,25,16777215,80083fe7,0
1940.036,投了吧，至少还能活着,1,25,16777215,80083fe7,0
325.799,可惜了，二爷,1,25,16777215,3ef6a282,0
1982.872,无语啊,1,25,16777215,83ea8a6e,0
1977.369,刘备那些人去哪里了。。。。,1,25,16777215,83ea8a6e,0
1497.645,攻取三郡，手到擒来,1,25,16777215,26943737,0
2438.736,雪肯定是真的啊，都是实景，那时候哪有那么多经费搞人工降雪,1,25,16776960,4b71e38a,0
1668.714,吴国各种捣乱,1,25,16777215,8338b605,0
1019.836,不管怎样 二爷千古,1,25,16776960,4b71e38a,0
1832.52,鼠目寸光是为鼠辈也,1,25,16777215,842291bf,0
730.335,关羽的英雄碎片马上到手,1,25,16777215,a8351f77,0
2517.607,死路一条啊,1,25,14811775,afeca104,0
1277.159,好惨，,1,25,14811775,afeca104,0
2165.509,群演最长的一次长镜头,1,25,16777215,819d3e4a,0
1124.69,伤口像一个脸,1,25,16777215,afeca104,0
2396.761,吴吹别隔这叫,1,25,16777215,c2dae769,0
2232.116,吴吹收收味,1,25,16777215,c2dae769,0
1372.418,东吴就是要杀死关羽啊,1,25,16777215,819d3e4a,0
1219.454,三气周瑜回来了,1,25,16777215,819d3e4a,0
1275.616,东合孙权，北具拒曹超,1,25,16777215,606c58ec,0
561.071,我小时候看原文的三国演义真的对陆逊这个人又爱又恨,1,25,16777215,c89b0bc8,0
814.916,那些觉得大魏吴王背刺是好计谋的，多半是目光短浅，只顾眼前利益的人,1,25,16777215,a5c6db01,0
2388.485,马儿都哭了，何况是人，每次看到这里都忍不住哭，演的太好了,1,25,16777215,26558c98,0
1936.927,凤雏在说不定能扭转乾坤,1,25,16777215,26558c98,0
1756.626,东和东吴，北拒曹操啊，暂时诈降肯定就赢了,1,25,16777215,26558c98,0
1694.89,那你死了，备备得伤心死了,1,25,16777215,26558c98,0
1673.498,诈降也行啊,1,25,16777215,26558c98,0
2607.488,永远的关公，永远的武圣！,1,25,16777215,a40e0b0d,0
2475.695,关公败了也是永远的武圣！,1,25,16777215,a40e0b0d,0
2367.486,此生无悔粉季汉,1,25,16777215,a40e0b0d,0
2342.305,拍得太凄美了,1,25,16777215,a40e0b0d,0
2225.932,我哭死,1,25,16777215,a40e0b0d,0
2195.532,谁说二爷人缘差的,1,25,16777215,a40e0b0d,0
209.356,玉可碎而不可毁其白，竹可焚而不可毁其节。,1,25,38979,43ed209b,0
2013.677,好感人啊,1,25,16777215,a40e0b0d,0
1992.688,哈哈哈放过孩子吧,1,25,16777215,a40e0b0d,0
1737.091,一门忠烈,1,25,16777215,a40e0b0d,0
1714.116,关公千古,1,25,16777215,a40e0b0d,0
1704.516,二爷太会说了,1,25,16777215,a40e0b0d,0
1695.527,玉可碎而不可改其白,1,25,16777215,a40e0b0d,0
1657.447,孙权贼子,1,25,16777215,a40e0b0d,0
679.774,姐姐们颜值都好绝,1,25,16777215,a40e0b0d,0
672.514,小姐姐们人美身材也好,1,25,16777215,a40e0b0d,0
640.373,美女们可真养眼啊,1,25,16777215,a40e0b0d,0
650.967,哇舞蹈演员全是美女,1,25,16777215,a40e0b0d,0
1156.22,只要蜀国灭亡东吴基本没有抵抗曹魏机会，也就灵了鲁肃的话,1,25,16777215,a9bb2c87,0
457.54,.,1,25,16777215,dbead4ff,0
1285.485,一生只此一败，一败终此一生。,5,25,15138834,410c31f3,0
375.766,手段下作算哪门子谋略，照这个逻辑扫射飞行员也很有谋略,1,25,16777215,dbf274e9,0
2585.237,痛，太痛了,1,25,16777215,72932a5c,0
1831.097,东吴鼠辈,1,25,16777215,3c9b6cca,0
1185.143,刚愎自用,1,25,16777215,17fc19af,0
2127.132,可惜箭伤未愈,1,25,16777215,ba8303,0
1938.719,有几挺马克沁，几十把ak，两门迫击炮说不定可以,1,25,16777215,f974e45f,0
1289.966,留得青山在，不怕没柴烧。,1,25,16777215,7b7f9d19,0
659.554,荆州可以拿回来，但是关羽不能杀，如果不是因为东吴目光短浅，怕他取不了天下？,1,25,16777215,f974e45f,0
1066.459,唉，凤雏在，亮就在荆州,1,25,16777215,d2d5b19d,0
1138.625,糜竹因为糜芳这件事，羞愧至死,5,25,16707842,3c211cd4,0
2575.466,呜呜呜不敢看，我想到关羽骑着大马拿着青龙偃月刀在河边在夕阳下的雄姿想哭,1,25,16777215,60195b76,0
1266.419,我想抱抱他，呜呜呜呜,1,25,16777215,ca8491e6,0
2783.934,关二爷千古,1,25,16777215,d31688d0,0
2530.324,把旗扔了吧,1,25,16777215,d31688d0,0
2468.74,就别点火把了,1,25,16777215,d31688d0,0
2395.085,赤兔马还在吗,1,25,16777215,d31688d0,0
2355.443,项羽关羽都是真英雄，不任性的话历史都会改写,1,25,16777215,d31688d0,0
2242.918,胡子一割，衣服一换，跑了再说,1,25,16777215,d31688d0,0
2126.981,就不该走有路的地方,1,25,16777215,d31688d0,0
2088.338,学学刘邦当年是如何逃命的,1,25,16777215,d31688d0,0
1530.384,所以说，不管在什么情况下都不能随便听信他人之言，尤其是说他人对你评价，都是挑拨,1,25,16777215,d31688d0,0
1473.728,刘封不该不救，毕竟是叔父,1,25,16777215,d31688d0,0
1465.69,这细节，现在根本拍不出来,1,25,16777215,d31688d0,0
1434.934,做人不能任性，有时一人生死决定历史走向,1,25,16777215,d31688d0,0
2424.551,关将军！关将军啊！,5,25,15138834,76897048,0
1223.149,吕蒙这也都是跟诸葛亮学的,1,25,16777215,d31688d0,0
694.891,现在再拍，估计就是一群网红脸在这里群魔乱舞,1,25,16777215,d31688d0,0
667.614,是嫦娥吗,1,25,16777215,d31688d0,0
491.669,也怪不得东吴，刘备不讲武德,1,25,16777215,d31688d0,0
352.479,自古送礼就能走后门,1,25,16777215,d31688d0,0
288.133,看你怎么通知其他船上的人,1,25,16777215,d31688d0,0
202.58,从此就不好看了,1,25,16777215,d31688d0,0
2595.821,主要是有关羽，跟刘备换什么不行，非要杀了，拼个你死我活,1,25,16777215,f700ab65,0
2368.919,泪目,1,25,16777215,e46a1889,0
2066.339,别走!,1,25,16777215,e46a1889,0
2576.742,江东鼠辈，背刺后如果大败曹魏，取得天下了，还不失为个英雄，结果当上大魏吴王了，真是个鼠辈，鼠辈，鼠辈！！！,1,25,16777215,2d40b938,0
241.919,火种永存,1,25,16777215,537350c,0
1124.79,糜芳投降真是个谜,1,25,16777215,f36bc660,0
1581.716,西西物质魏俊杰,1,25,16777215,45084d11,0
1851.131,围师必阙,1,25,16777215,eed7055e,0
376.449,古今多少事，都付弹中,1,25,16777215,d489edd1,0
1623.483,孤城你们还来攻,1,25,16777215,3d902004,0
1167.052,回去找诸葛亮啊,1,25,16777215,3d902004,0
1028.306,快通知诸葛,1,25,16777215,3d902004,0
182.511,麦成了啊,1,25,16777215,3d902004,0
2142.026,生擒就行了，为什么要杀害啊，哎,1,25,16777215,f483297b,0
700.283,是奶奶又怎样，奶奶也是比你家奶奶好看的漂亮奶奶,1,25,16777215,f483297b,0
888.34,两个50多岁老头PK，力气都不如从前了,1,25,16777215,182b28fb,0
664.07,东吴基本就没和对手刚正面过,1,25,16777215,182b28fb,0
1632.036,大业指:最大本事就是只能守住建业,1,25,15138834,4da38e75,0
1026.026,吕蒙三气关羽,1,25,15138834,4da38e75,0
17.146,家人们，跑的还能跑,1,25,16777215,a558d6,0
2078.992,二爷的意思是死就死，而不是我谁也不怕，懂？,5,25,38979,feec628,0
1130.064,说关羽性格问题的都是鼠目寸光吧，谁能想到吴能背刺啊，换赵云来都没用！,5,25,38979,feec628,0
719.675,给曹老板整不会了,5,25,38979,feec628,0
652.454,大业可笑死我了，这一背刺蜀吴这辈子翻不了身了,5,25,15138834,feec628,0
636.987,吴国就好比玩斗地主你农民猛管另一个农民牌，250一个,5,25,15138834,feec628,0
632.891,吴国还用贬，你看看他做的是人事吗？,5,25,15138834,feec628,0
560.805,跟关羽自傲有什么关系？自家亲戚背叛你就是赵云也没法啊！,5,25,15138834,feec628,0
500.646,我宁愿意大利是我的盟友也不要东吴，毕竟人家不偷袭友军,5,25,15138834,feec628,0
451.728,你东吴夺了荆州有啥进展吗？二爷可是把曹操打的要迁都了,5,25,15138834,feec628,0
363.024,孙权真啥狗啊，背刺没了三国鼎立的局面,5,25,15138834,feec628,0
322.086,吕蒙是真小人啊，用最下流的手段夺荆州，不喷你喷谁！,5,25,15138834,feec628,0
267.92,下三滥之辈,5,25,15138834,feec628,0
208.187,小人吕蒙，搞偷袭谁不会啊，有什么好骄傲的,1,25,15138834,feec628,0
424.038,江东鼠辈！,1,25,16777215,c1021c22,0
1951.96,就说南王孟获起兵攻打建业,1,25,16777215,1ad3bdb9,0
1962.156,就说西凉马腾打建业了,1,25,16777215,fb920e18,0
638.398,鼠辈，鼠辈，毫无信义，遗臭万年。,1,25,16777215,2d40b938,0
1450.362,然后廖化直接跑成都了,1,25,16777215,fb920e18,0
1410.47,争分夺秒现在就该跑,1,25,16777215,fb920e18,0
1271.661,废话曹操在怎么样输的是自己的事业，关羽输的大哥的，心态能一样吗,1,25,16777215,534a6383,0
640.494,荆州不留个大将守着？？？？,1,25,16777215,fb920e18,0
560.668,古今多少事，都附笑谈中,1,25,16777215,4dedeffe,0
1176.236,最难的时候自己也没什么东西啊，现在投降还有个城池,1,25,16777215,39e6ba4a,0
2643.185,二爷千古,5,25,15138834,f65d48c6,0
2384.148,新三国那个逼王就没见他哭过,1,25,16777215,afbcab5e,0
1648.793,不要脸就可以诈投,1,25,15138834,c32b4808,0
2631.958,二爷千古,1,25,16777215,de0176ae,0
2098.022,趁着夜色抹黑出城逃走不行吗,1,25,16777215,b1ad8ca2,0
2005.904,都乔装百姓就不行吗,1,25,16777215,b1ad8ca2,0
1048.123,双拳难敌四手，何况还多了诡计,1,25,16777215,b1ad8ca2,0
954.448,最忠义的人也难逃被人负义，唉,1,25,16777215,b1ad8ca2,0
217.595,要是有个谋士提醒一下就好了,1,25,16777215,b1ad8ca2,0
1776.141,吴国为什么一定要杀关羽，杀关羽肯定就会被刘备恨的,1,25,16777215,669e59f,0
1458.456,首先是正面有魏国曹仁徐晃，后面有吕蒙偷袭，加上糜芳傅士仁叛变，唯一的救兵也不来救，四面被围，没办法了,1,25,16777215,669e59f,0
945.746,女没有嘛,1,25,16777215,b3a07055,0
945.234,诸葛亮他们在干嘛啊,1,25,16777215,b3a07055,0
1946.42,一挺机枪可以解围,1,25,16777215,afbcab5e,0
1626.74,好，我有三约,1,25,16777215,afbcab5e,0
1474.561,够了，五百小刀手可敌千军万马,1,25,16777215,afbcab5e,0
652.269,舒服了,1,25,16777215,fb68128b,0
480.368,说江东鼠辈的 都是嫉妒江东的人,1,25,16777215,fb68128b,0
2724.46,不觉泪下,1,25,16777215,ea5d2542,0
2652.477,江东鼠辈！！！,1,25,16777215,ea5d2542,0
1322.195,东吴鼠辈,1,25,16777215,ea5d2542,0
1155.661,前期那么难都扛过来了，地位又高又有钱，是真的迷,1,25,16777215,ea5d2542,0
48.384,东吴鼠辈,1,25,16777215,ea5d2542,0
922.345,报警了？,1,25,15138834,e9ef43bf,0
1272.759,不想看了,1,25,16777215,ba8303,0
494.68,东吴不敢北伐，要荆州何用,1,25,16777215,ba8303,0
198.859,偷袭,1,25,16777215,ba8303,0
488.423,之前就还了三个郡，说不还的真好笑,1,25,16777215,5fd6b626,0
2132.108,呜呜呜，周仓为二爷扛了一辈子刀,1,25,16777215,8363c571,0
645.964,唉,1,25,16777215,6ca345fd,0
516.604,唉,1,25,16777215,6ca345fd,0
1847.144,这孙权毫无自我判断力。就由着部下说啥是啥,1,25,16777215,c189de71,0
1841.682,擒了就擒了，你不该杀他啊。一杀关羽整个三国就全垮了,1,25,16777215,c189de71,0
2616.301,二爷千古！,1,25,38979,46a2a3fe,0
2276.795,刀架子,1,25,16777215,c69960f6,0
1586.3,岂不美哉,5,25,15138834,b148c996,0
1714.868,    道理都懂，但是识时务者为俊杰啊,1,25,16777215,3ae90cac,0
1895.12,鼠辈就是鼠辈！,5,25,15138834,3272686c,0
536.768,管你蜀粉魏粉吴粉，都不如俺豆粉,1,25,9599289,debd3403,0
1156.749,糜方元老级了,1,25,15138834,c32b4808,0
925.396,马超为什么不来帮忙？,1,25,15138834,c32b4808,0
1943.917,就说那西凉马腾,1,25,16777215,d267d4dd,0
2422.265,小时候就很敬佩关羽，懂事了之后更加敬佩,1,25,16777215,46e71c07,0
469.394,就算东吴寸步未进，那也是人家的事，凭什么就给蜀汉？给了蜀汉让他来灭人家东吴吗？蜀汉粉真搞笑，蜀汉攻打谁好像在你们眼里都是应该的一样,1,25,16777215,4cbc89e5,0
1959.404,要是燕双鹰在就好了,1,25,16777215,6cff69d,0
219.431,前面那个，什么叫曹操走之前带走关羽？你咋不说关羽走了顺便把曹操张飞也带走了？,1,25,16777215,4cbc89e5,0
1553.59,唉，但凡凤雏没死，哪有这帮人跳的机会,1,25,16777215,1319ee1a,0
1218.666,靡芳不知道怎么想的,1,25,16777215,1319ee1a,0
1341.584,罗贯中:我当时也不知道什么是饭圈啊,1,25,16777215,afbcab5e,0
1295.422,三国演义本来就是罗贯中写的尊刘贬曹，一群人看演义来考古呢,1,25,16777215,afbcab5e,0
1093.549,孙吴心心念念荆州久矣，今日得之，实属意料之中,1,25,16777215,848d06a2,0
1021.754,诸葛都叫他守城不出了！可惜了啊，出去必败啊,1,25,16777215,848d06a2,0
961.803,安定军心，退到川中并且派人去搬救兵,1,25,16777215,44905f91,0
1163.836,好像演义里面赵累提醒过关羽，但关羽没在意,1,25,16777215,201820a0,0
606.049,其实孙刘联盟破灭是必然的，但是没想到会这么快,1,25,16777215,848d06a2,0
970.597,刘封只能说没脑子，在演义中他还是忠蜀国的，刘备杀了他之后就后悔了,1,25,16777215,201820a0,0
2351.526,卧槽，这段太难受了，，，,1,25,16777215,8827becb,0
1815.931,东吴夺城就行，还二爷给刘备呀,1,25,16777215,91bae539,0
258.793,什么双标？只许诸葛用计叫智谋，不许东吴用计叫阴比？什么鼠辈，各为其主，各有谋略，这不是三国的精华所在吗？,1,25,15138834,40ae3555,0
2.621,我来看望大家,1,25,16511312,aa595bc5,0
2099.7,赤兔马也老了~,1,25,16777215,f55acca4,0
2354.517,这波周将军赢了,1,25,16777215,f5e4bff7,0
2226.157,泪目,1,25,16777215,f5e4bff7,0
2075.439,又不听,1,25,16777215,f5e4bff7,0
1809.119,看不下去了,1,25,16777215,f5e4bff7,0
1774.719,你不配,1,25,16777215,f5e4bff7,0
1715.959,格局,1,25,16777215,f5e4bff7,0
1641.719,假意投降,1,25,16777215,f5e4bff7,0
1624.719,孙子,1,25,16777215,f5e4bff7,0
277.48,果然只有优势最大的那方才有机会统一天下,1,25,16777215,848d06a2,0
1918.785,就瞧不起东吴，咋地？,1,25,16777215,4512f126,0
1059.454,我要是有二爷的武力，战绩，地位，声望，我比他还傲,1,25,16777215,4512f126,0
1533.317,小人,1,25,16777215,f5e4bff7,0
1283.186,胜败乃兵家常事,1,25,16777215,f5e4bff7,0
792.74,欺负关羽,1,25,16777215,f5e4bff7,0
676.844,孙子,1,25,16777215,f5e4bff7,0
1659.655,就为了报答曹操那点恩情，关羽宁可掉脑袋都会放他一马。拿什么能劝他背叛刘备？,1,25,16777215,268e50a3,0
339.51,利用他国善政,5,25,16776960,fb041b6a,0
301.683,商船为什么设置城墙一样的外围防御,5,25,16776960,fb041b6a,0
145.072,唉,1,25,16777215,f5e4bff7,0
106.42,再过几集只有丞相了,1,25,16777215,f5e4bff7,0
1986.23,为什么不假投曹操，然后用城池换二爷,1,25,16777215,c217fb3a,0
1770.979,虎女岂能嫁犬子,1,25,16777215,c217fb3a,0
1268.408,神关羽：谁来与我同去？！,1,25,16777215,c217fb3a,0
1193.103,贾充？,1,25,16777215,322ec48d,0
1507.229,孙一峰黄旭东,1,25,16777215,8359dce3,0
2188.05,3D的声音,5,25,14811775,51f92e97,0
2002.791,我不明白既然让关将军镇守荆州为什么又派他攻打樊城,5,25,14811775,51f92e97,0
1265.084,嗨，关将军就是知道兄长对他的关心所以才觉得难,5,25,14811775,51f92e97,0
2357.312,很难不泪目,1,25,16777215,54604d75,0
247.836,人生大起大落得太快，巅峰过后就是暗淡,1,25,16777215,f08f560,0
2423.273,真男儿,1,25,16777215,41d40589,0
1431.014,孟达：今举兵投魏，亦可封王拜相一展宏图,1,25,16777215,2ac5fc69,0
1035.412,心疼,1,25,16777215,41d40589,0
1035.412,心疼,1,25,16777215,41d40589,0
1035.412,心疼,1,25,16777215,41d40589,0
1506.011,刘封此时若力王狂澜，必先李世民500年建功,1,25,16777215,f79b995c,0
2089.466,东吴唯一看见关羽对孙刘联盟重要意义的人叫鲁肃，他已经挂了,5,25,16707842,958e1b79,0
1664.852,全文背诵,5,25,16707842,958e1b79,0
1159.529,傅士仁有英布之相，糜竺更是易节之流,5,25,16707842,958e1b79,0
1126.861,箭创崩裂，无力回天,5,25,16707842,958e1b79,0
1047.47,关羽之傲，非寻常谋臣可柬,5,25,16707842,958e1b79,0
790.474,我也是这么想的，贾诩，我们鼠辈所见略同,5,25,16707842,958e1b79,0
515.469,子敬之谋，毁于一旦,1,25,16777215,be80426,0
1162.235,小舅子贪污怕被处理,1,25,16777215,5e0896e5,0
184.507,云长～,1,25,16777215,b2aa37b7,0
33.712,君子被小人搞死,1,25,16777215,f5e4bff7,0
1247.666,曹操 胜败乃兵家常事,1,25,16777215,36941d66,0
2072.05,原著里这是体现关羽傲的情节，这里改的很好，体现二爷深思熟虑，因为大路更没有希望。,5,25,16707842,ba356103,0
1928.49,能请来封神演义里的姜子牙倒是可以突围。,5,25,16707842,ba356103,0
1816.799,吕蒙杀了关羽之后，关羽就附身吕蒙身上，把吕蒙魂夺走了,1,25,16777215,db60a29f,0
1649.713,张辽：想学劝降？我教你啊,1,25,16777215,f41d1e6e,0
875.415,公明：轻点，我帽子快掉了,1,25,16777215,f41d1e6e,0
2369.127,看哭了玛德,1,25,16777215,8f8870ad,0
1245.032,演的真好啊，看得我都落泪了,1,25,16777215,8f8870ad,0
2664.112,二爷,5,25,16777215,519dd1b5,0
1173.021,我儿子只会说精吴狂喜,1,25,16777215,1fe1f8a0,0
2469.202,将军千古啊,1,25,16777215,3f6a270b,0
2375.343,不要兄弟了嘛，来不及后悔不已！,1,25,16777215,52fa0078,0
2212.823,为何诸葛没算到，援军为何不到，只有累死,1,25,16777215,52fa0078,0
2099.383,说句不好听的，为手下几百人，找个地方躲躲吧,1,25,16777215,52fa0078,0
495.626,东吴的士族只是希望早日太平，当然愿意尽快统一。,1,25,16777215,15f401fb,0
1965.583,怎么能杀关羽呢，那方杀之，就是死敌,1,25,16777215,52fa0078,0
1777.543,诸葛瑾，和诸葛亮差十万八千里啊，好像都我负人,1,25,16777215,52fa0078,0
218.811,江东鼠标,1,25,16777215,385e5be,0
1945.98,这里演员全部动情了,1,25,16777215,8db582ea,0
1243.383,你死了，才是连累蜀国，太要面子了,1,25,16777215,52fa0078,0
2602.961,二爷千古,1,25,16777215,74c2139,0
965.352,英雄末路,1,25,16777215,ac4f949c,0
2541.929,东吴还穿雪地吉利服,1,25,16777215,4499af5c,0
195.388,别走麦城,1,25,16777215,f26226cb,0
198.851,从现在开始，全是虐文,1,25,16777215,337d4211,0
669.479,鼠辈,1,25,16777215,d2ccf04f,0
1897.49,君子怕小人啊,1,25,16777215,351604ff,0
1638.815,清高得罪人,1,25,16777215,351604ff,0
189.638,大江东去，浪淘尽，千古风流人物,5,25,15138834,e8b29346,0
1297.797,春秋满是仁义道德之理，论学什么的重要性,1,25,16777215,4a10488c,0
2550.099,前面说为什么不去找刘备和诸葛亮的，你猜猜为什么有小路突围？？？,1,25,16777215,1ec4c7c8,0
673.336,刘备织席贩履之辈，直接阶级跨越，肯定受到器重的,1,25,16777215,4a10488c,0
1828.03,临沮，在今宜昌境内，从此可走秭归，通奉节而归四川,1,25,16777215,eeb348df,0
1185.946,关羽归曹操是200年，现在是219年，过去快20年了,1,25,16777215,eeb348df,0
433.363,打荆州还不如打青徐,1,25,16777215,eeb348df,0
2693.96,英雄迟暮！,1,25,15138834,7347c778,0
1629.688,英明之主（大嘘）,1,25,16777215,5b85ba60,0
2073.018,关平不该死啊。培养这么久,1,25,16777215,86878fd8,0
2003.402,关平？？？？？？,1,25,16777215,86878fd8,0
1795.762,可惜了，关平不死，可能还有转机,1,25,16777215,86878fd8,0
1487.188,刘封形同造反,1,25,16777215,86878fd8,0
1013.362,重大失误,1,25,16777215,86878fd8,0
2561.191,活捉关羽！,1,25,16777215,f7fb6cd1,0
1006.609,哈哈哈哈哈,1,25,16777215,f7fb6cd1,0
1325.405,关羽:关闭羽翼，难再飞,1,25,16777215,4499af5c,0
2640.439,不是潘璋吧！是潘璋的部下马忠,1,25,16777215,9cadccbd,0
2650.698,二爷千古！纪念陆树铭老爷子，永远的关公,1,25,15138834,9bf0ea72,0
1297.97,云长没有防小人之心和经验,1,25,16777215,30f22f0f,0
1227.146,只能说。谁夺了荆州。  赚了关羽。 还是很厉害的,1,25,16777215,30f22f0f,0
1148.303,关羽没有防小人之心,1,25,16777215,30f22f0f,0
1034.118,关羽敌我不分 智力可能不如张飞,1,25,16777215,30f22f0f,0
1024.472,两军对阵 竟信敌言 就是张飞也不会如此糊涂,1,25,16777215,30f22f0f,0
256.466,陆谦之计 并不是鼠辈 诸葛亮也用过此类计策 此乃骄兵之计 自古有之 敌人的话也信 二爷太飘了,1,25,16777215,30f22f0f,0
1.576,小陈你的推送不要太过分（怒）,1,25,16777215,9626d0a9,0
2568.583,5500人埋伏10个人 这是要切碎云长,1,25,16777215,c356213,0
2293.584,投降能火 逃走遇到激战 战死,1,25,16777215,c356213,0
2225.72,只能死后见面了 朋友,1,25,16777215,c356213,0
2084.392,投降曹操吧 二弟,1,25,16777215,c356213,0
1474.491,曹孙军队十几万 顷刻之间消灭关羽,1,25,16777215,c356213,0
2444.946,周仓得知关羽死后也自刎了,1,25,16777215,f0ea79e4,0
2294.134,周仓怎么可能怕死,1,25,16777215,58c22e69,0
1085.305,二爷老了啊,1,25,16777215,58c22e69,0
1962.996,我有一计,1,25,16777215,9bcd3514,0
370.42,关羽张飞配什么谋士都没用,1,25,16777215,9ff74312,0
260.156,那个时候没那么多花花肠子，道德标准不一样，看看周礼就知道了，还有春秋前期国战,1,25,16777215,351604ff,0
